[
  {
    "id": "mit",
    "name": "Massachusetts Institute of Technology",
    "state": "MA",
    "city": "Cambridge",
    "setting": "urban",
    "undergrad_enrollment": 4600,
    "type": "private",
    "major_categories": ["computer-science", "engineering", "mathematics", "physics", "biology", "economics"],
    "acceptance_rate_overall": 3.7,
    "acceptance_rate_intl": 2.9,
    "sat25": 1520, "sat50": 1555, "sat75": 1580,
    "act25": 35, "act50": 36, "act75": 36,
    "gpa_distribution": null,
    "test_policy": "required",
    "ielts_min": 7.0, "toefl_min": 100,
    "cost_of_attendance_usd": 85000,
    "intl_aid_policy": "need-blind-full-need",
    "avg_intl_aid_usd": 70000, "pct_intl_receiving_aid": 90,
    "cds_url": "https://ir.mit.edu/cds",
    "admission_source_url": "https://mitadmissions.org/apply/process/stats/",
    "admission_source_year": "2023-24",
    "cost_source_url": "https://sfs.mit.edu/cost-of-attendance/",
    "cost_source_year": "2024-25",
    "aid_source_url": "https://sfs.mit.edu/international-students/",
    "aid_source_year": "2023-24",
    "field_confidence": {
      "acceptance_rate_overall": "estimated",
      "acceptance_rate_intl": "estimated",
      "sat25": "estimated", "sat50": "estimated", "sat75": "estimated",
      "avg_intl_aid_usd": "estimated",
      "pct_intl_receiving_aid": "estimated",
      "gpa_distribution": "missing"
    }
  },
  {
    "id": "harvard",
    "name": "Harvard University",
    "state": "MA",
    "city": "Cambridge",
    "setting": "urban",
    "undergrad_enrollment": 7100,
    "type": "private",
    "major_categories": ["economics", "computer-science", "biology", "political-science", "mathematics", "engineering"],
    "acceptance_rate_overall": 3.4,
    "acceptance_rate_intl": 3.0,
    "sat25": 1500, "sat50": 1540, "sat75": 1580,
    "act25": 34, "act50": 35, "act75": 36,
    "gpa_distribution": null,
    "test_policy": "required",
    "ielts_min": 7.0, "toefl_min": 100,
    "cost_of_attendance_usd": 86000,
    "intl_aid_policy": "need-blind-full-need",
    "avg_intl_aid_usd": 75000, "pct_intl_receiving_aid": 80,
    "cds_url": "https://oir.harvard.edu/fact-book/common-data-set",
    "admission_source_url": "https://college.harvard.edu/admissions/admissions-statistics",
    "admission_source_year": "2023-24",
    "cost_source_url": "https://college.harvard.edu/financial-aid/how-aid-works/cost-attendance",
    "cost_source_year": "2024-25",
    "aid_source_url": "https://college.harvard.edu/financial-aid/how-aid-works/international-students",
    "aid_source_year": "2023-24",
    "field_confidence": {
      "acceptance_rate_overall": "estimated",
      "acceptance_rate_intl": "estimated",
      "sat25": "estimated", "sat50": "estimated", "sat75": "estimated",
      "test_policy": "estimated",
      "avg_intl_aid_usd": "estimated",
      "pct_intl_receiving_aid": "estimated",
      "gpa_distribution": "missing"
    }
  },
  {
    "id": "stanford",
    "name": "Stanford University",
    "state": "CA",
    "city": "Stanford",
    "setting": "suburban",
    "undergrad_enrollment": 7800,
    "type": "private",
    "major_categories": ["computer-science", "engineering", "biology", "economics", "humanities-languages", "design-art"],
    "acceptance_rate_overall": 3.6,
    "acceptance_rate_intl": 3.0,
    "sat25": 1500, "sat50": 1535, "sat75": 1570,
    "act25": 34, "act50": 35, "act75": 35,
    "gpa_distribution": null,
    "test_policy": "optional",
    "ielts_min": 7.0, "toefl_min": 100,
    "cost_of_attendance_usd": 87000,
    "intl_aid_policy": "need-aware",
    "avg_intl_aid_usd": 65000, "pct_intl_receiving_aid": 60,
    "cds_url": "https://ucomm.stanford.edu/cds/",
    "admission_source_url": "https://admission.stanford.edu/apply/selection/profile.html",
    "admission_source_year": "2023-24",
    "cost_source_url": "https://financialaid.stanford.edu/undergrad/budget/",
    "cost_source_year": "2024-25",
    "aid_source_url": "https://financialaid.stanford.edu/undergrad/apply/international.html",
    "aid_source_year": "2023-24",
    "field_confidence": {
      "acceptance_rate_intl": "estimated",
      "avg_intl_aid_usd": "estimated",
      "pct_intl_receiving_aid": "estimated",
      "gpa_distribution": "missing"
    }
  },
  {
    "id": "princeton",
    "name": "Princeton University",
    "state": "NJ",
    "city": "Princeton",
    "setting": "suburban",
    "undergrad_enrollment": 5600,
    "type": "private",
    "major_categories": ["economics", "computer-science", "engineering", "political-science", "mathematics"],
    "acceptance_rate_overall": 5.7,
    "acceptance_rate_intl": 5.0,
    "sat25": 1500, "sat50": 1545, "sat75": 1580,
    "act25": 34, "act50": 35, "act75": 36,
    "gpa_distribution": null,
    "test_policy": "required",
    "ielts_min": 7.0, "toefl_min": 100,
    "cost_of_attendance_usd": 83000,
    "intl_aid_policy": "need-blind-full-need",
    "avg_intl_aid_usd": 68000, "pct_intl_receiving_aid": 100,
    "cds_url": "https://provost.princeton.edu/common-data-set",
    "admission_source_url": "https://admission.princeton.edu/how-apply/admission-statistics",
    "admission_source_year": "2023-24",
    "cost_source_url": "https://admission.princeton.edu/cost-aid/cost-attend",
    "cost_source_year": "2024-25",
    "aid_source_url": "https://admission.princeton.edu/cost-aid/international-students",
    "aid_source_year": "2023-24",
    "field_confidence": {
      "acceptance_rate_overall": "estimated",
      "acceptance_rate_intl": "estimated",
      "sat25": "estimated", "sat50": "estimated", "sat75": "estimated",
      "test_policy": "estimated",
      "avg_intl_aid_usd": "estimated",
      "gpa_distribution": "missing"
    }
  },
  {
    "id": "yale",
    "name": "Yale University",
    "state": "CT",
    "city": "New Haven",
    "setting": "urban",
    "undergrad_enrollment": 6800,
    "type": "private",
    "major_categories": ["economics", "political-science", "humanities-languages", "computer-science", "biology"],
    "acceptance_rate_overall": 4.5,
    "acceptance_rate_intl": 4.0,
    "sat25": 1500, "sat50": 1545, "sat75": 1580,
    "act25": 34, "act50": 35, "act75": 36,
    "gpa_distribution": null,
    "test_policy": "required",
    "ielts_min": 7.0, "toefl_min": 100,
    "cost_of_attendance_usd": 87000,
    "intl_aid_policy": "need-blind-full-need",
    "avg_intl_aid_usd": 70000, "pct_intl_receiving_aid": 100,
    "cds_url": "https://oir.yale.edu/common-data-set",
    "admission_source_url": "https://admissions.yale.edu/admissions-statistics",
    "admission_source_year": "2023-24",
    "cost_source_url": "https://admissions.yale.edu/cost-of-attendance",
    "cost_source_year": "2024-25",
    "aid_source_url": "https://admissions.yale.edu/financial-aid-international-students",
    "aid_source_year": "2023-24",
    "field_confidence": {
      "acceptance_rate_intl": "estimated",
      "test_policy": "estimated",
      "avg_intl_aid_usd": "estimated",
      "gpa_distribution": "missing"
    }
  },
  {
    "id": "columbia",
    "name": "Columbia University",
    "state": "NY",
    "city": "New York",
    "setting": "urban",
    "undergrad_enrollment": 6300,
    "type": "private",
    "major_categories": ["economics", "computer-science", "political-science", "international-relations", "engineering"],
    "acceptance_rate_overall": 3.9,
    "acceptance_rate_intl": 3.5,
    "sat25": 1500, "sat50": 1530, "sat75": 1560,
    "act25": 34, "act50": 35, "act75": 35,
    "gpa_distribution": null,
    "test_policy": "optional",
    "ielts_min": 7.0, "toefl_min": 100,
    "cost_of_attendance_usd": 89000,
    "intl_aid_policy": "need-aware",
    "avg_intl_aid_usd": 60000, "pct_intl_receiving_aid": 50,
    "cds_url": "https://www.columbia.edu/content/institutional-research.html",
    "admission_source_url": "https://undergrad.admissions.columbia.edu/apply/first-year/decisions",
    "admission_source_year": "2023-24",
    "cost_source_url": "https://undergrad.admissions.columbia.edu/cost",
    "cost_source_year": "2024-25",
    "aid_source_url": "https://cc-seas.financialaid.columbia.edu/types/international",
    "aid_source_year": "2023-24",
    "field_confidence": {
      "acceptance_rate_intl": "estimated",
      "avg_intl_aid_usd": "estimated",
      "pct_intl_receiving_aid": "estimated",
      "gpa_distribution": "missing"
    }
  },
  {
    "id": "upenn",
    "name": "University of Pennsylvania",
    "state": "PA",
    "city": "Philadelphia",
    "setting": "urban",
    "undergrad_enrollment": 10500,
    "type": "private",
    "major_categories": ["business", "economics", "engineering", "computer-science", "biology", "communications"],
    "acceptance_rate_overall": 5.7,
    "acceptance_rate_intl": 5.0,
    "sat25": 1500, "sat50": 1535, "sat75": 1570,
    "act25": 34, "act50": 35, "act75": 35,
    "gpa_distribution": null,
    "test_policy": "optional",
    "ielts_min": 7.0, "toefl_min": 100,
    "cost_of_attendance_usd": 88000,
    "intl_aid_policy": "need-blind-full-need",
    "avg_intl_aid_usd": 65000, "pct_intl_receiving_aid": 60,
    "cds_url": "https://ira.upenn.edu/cds",
    "admission_source_url": "https://admissions.upenn.edu/admission-statistics",
    "admission_source_year": "2023-24",
    "cost_source_url": "https://srfs.upenn.edu/cost-of-attendance",
    "cost_source_year": "2024-25",
    "aid_source_url": "https://srfs.upenn.edu/financial-aid/international-first-year-applicants",
    "aid_source_year": "2024-25",
    "field_confidence": {
      "acceptance_rate_overall": "estimated",
      "acceptance_rate_intl": "estimated",
      "sat25": "estimated", "sat50": "estimated", "sat75": "estimated",
      "test_policy": "estimated",
      "intl_aid_policy": "estimated",
      "avg_intl_aid_usd": "estimated",
      "pct_intl_receiving_aid": "estimated",
      "gpa_distribution": "missing"
    }
  },
  {
    "id": "caltech",
    "name": "California Institute of Technology",
    "state": "CA",
    "city": "Pasadena",